{
  "$schema": "http://json-schema.org/draft-07/schema#",
  "$id": "https://philterd.ai/schemas/policy.schema.json",
  "title": "Philter Policy",
  "description": "Minimal validation schema for a Philter PII/PHI redaction policy. Permissive on additional properties so policies remain forward-compatible with new Philter releases.",
  "type": "object",
  "required": ["name"],
  "properties": {
    "name": {
      "type": "string",
      "minLength": 1,
      "description": "Policy identifier — referenced when calling the Philter API."
    },
    "config": {
      "type": "object",
      "description": "Optional engine configuration (text splitting, encryption keys, etc.)."
    },
    "ignored": {
      "type": "array",
      "items": {"type": "string"},
      "description": "Terms the policy should not redact even when detected as an entity."
    },
    "ignoredPatterns": {
      "type": "array",
      "items": {"type": "string"},
      "description": "Regex patterns excluded from redaction."
    },
    "identifiers": {
      "type": "object",
      "description": "Map of entity-type configurations. Each key is an entity type (age, ssn, creditCard, etc.); each value declares one or more filter strategies."
    }
  },
  "additionalProperties": true
}
