{
  "name": "llm-training-data-prep",
  "config": {
    "splitting": {
      "enabled": true,
      "threshold": 8000
    }
  },
  "ignored": [],
  "identifiers": {
    "personsName": {
      "personsFilterStrategies": [
        {"strategy": "REPLACE", "redactionFormat": "[PERSON]", "conditions": "confidence > 55"}
      ]
    },
    "phoneNumber": {
      "phoneNumberFilterStrategies": [
        {"strategy": "REPLACE", "redactionFormat": "[PHONE]"}
      ]
    },
    "emailAddress": {
      "emailAddressFilterStrategies": [
        {"strategy": "REPLACE", "redactionFormat": "[EMAIL]"}
      ]
    },
    "ssn": {
      "ssnFilterStrategies": [
        {"strategy": "REPLACE", "redactionFormat": "[SSN]"}
      ]
    },
    "creditCard": {
      "onlyValidCreditCards": true,
      "creditCardFilterStrategies": [
        {"strategy": "REPLACE", "redactionFormat": "[CARD]"}
      ]
    },
    "ipAddress": {
      "ipAddressFilterStrategies": [
        {"strategy": "REPLACE", "redactionFormat": "[IP]"}
      ]
    },
    "url": {
      "urlFilterStrategies": [
        {"strategy": "REPLACE", "redactionFormat": "[URL]"}
      ]
    },
    "passportNumber": {
      "passportNumberFilterStrategies": [
        {"strategy": "REPLACE", "redactionFormat": "[PASSPORT]"}
      ]
    },
    "driversLicense": {
      "driversLicenseFilterStrategies": [
        {"strategy": "REPLACE", "redactionFormat": "[LICENSE]"}
      ]
    },
    "iban": {
      "ibanFilterStrategies": [
        {"strategy": "REPLACE", "redactionFormat": "[IBAN]"}
      ]
    },
    "physicianName": {
      "physicianNameFilterStrategies": [
        {"strategy": "REPLACE", "redactionFormat": "[PERSON]"}
      ]
    },
    "hospital": {
      "hospitalFilterStrategies": [
        {"strategy": "REPLACE", "redactionFormat": "[ORG]"}
      ]
    },
    "city": {
      "cityFilterStrategies": [
        {"strategy": "REPLACE", "redactionFormat": "[LOCATION]"}
      ]
    },
    "address": {
      "addressFilterStrategies": [
        {"strategy": "REPLACE", "redactionFormat": "[ADDRESS]"}
      ]
    }
  }
}
