{
  "name": "pci-dss-scope-reduction",
  "config": {
    "splitting": {
      "enabled": false,
      "threshold": 4000
    }
  },
  "ignored": [],
  "identifiers": {
    "creditCard": {
      "onlyValidCreditCards": true,
      "creditCardFilterStrategies": [
        {"strategy": "MASK", "maskCharacter": "*", "maskLength": "SAME", "leaveCharacters": 4}
      ]
    },
    "iban": {
      "ibanFilterStrategies": [
        {"strategy": "MASK", "maskCharacter": "*", "maskLength": "SAME", "leaveCharacters": 4}
      ]
    },
    "ssn": {
      "ssnFilterStrategies": [
        {"strategy": "REDACT", "redactionFormat": "[REDACTED-SSN]"}
      ]
    },
    "identifiers": [
      {
        "id": "cvv",
        "pattern": "\\b(?:CVV|CVC|CVV2|CSC)[\\s:#]*\\d{3,4}\\b",
        "caseSensitive": false,
        "identifierFilterStrategies": [
          {"strategy": "REDACT", "redactionFormat": "[REDACTED-CVV]"}
        ]
      },
      {
        "id": "card-expiration",
        "pattern": "\\b(?:EXP|EXPIRES?|EXPIRATION)[\\s:#]*(0[1-9]|1[0-2])[/\\-](\\d{2}|\\d{4})\\b",
        "caseSensitive": false,
        "identifierFilterStrategies": [
          {"strategy": "REDACT", "redactionFormat": "[REDACTED-EXP]"}
        ]
      }
    ]
  }
}
